{
        "experiment": "/data-analytics-pipeline/json-schema/inputTransformation/datasets/experiment.json",
        "phasedesc": "/data-analytics-pipeline/json-schema/inputTransformation/datasets/phasedesc.json",
        "phase": "/data-analytics-pipeline/json-schema/inputTransformation/datasets/phase.json",
        "action": "/data-analytics-pipeline/json-schema/inputTransformation/datasets/action.json",
        "player": "/data-analytics-pipeline/json-schema/inputTransformation/datasets/player.json",
        "functions": 
        [
      		{
       			"function": "h5",
       			"actionId":"requestsent",
        		"bin": 30,
        		"nd": "n15d6",
        		"numseconds":300
      		}
    	]
}
